2016-09-20 01:36:14.547384 2c:f0:a2:1a:30:2d > 01:00:5e:00:00:fb, ethertype IPv4 (0x0800), length 112: (tos 0x0, ttl 255, id 52422, offset 0, flags [none], proto UDP (17), length 98) 192.168.178.31.5353 > 224.0.0.251.5353: 0 [1au] PTR (QM)? _sleep-proxy._udp.local. (70)
2016-09-20 01:36:16.712470 70:56:81:c0:89:31 > c0:25:06:0d:95:59, ethertype IPv4 (0x0800), length 78: (tos 0x0, ttl 64, id 17487, offset 0, flags [DF], proto TCP (6), length 64) 192.168.178.39.59789 > 104.244.43.241.443: Flags [S], cksum 0xeb37 (correct), seq 2848041124, win 65535, options [mss 1460,nop,wscale 5,nop,nop,TS val 459270913 ecr 0,sackOK,eol], length 0
2016-09-20 01:36:16.742862 c0:25:06:0d:95:59 > 70:56:81:c0:89:31, ethertype IPv4 (0x0800), length 74: (tos 0x0, ttl 58, id 0, offset 0, flags [DF], proto TCP (6), length 60) 104.244.43.241.443 > 192.168.178.39.59789: Flags [S.], cksum 0x40f6 (correct), seq 3310928267, ack 2848041125, win 28960, options [mss 1460,sackOK,TS val 2116109579 ecr 459270913,nop,wscale 9], length 0
2016-09-20 01:36:16.742947 70:56:81:c0:89:31 > c0:25:06:0d:95:59, ethertype IPv4 (0x0800), length 66: (tos 0x0, ttl 64, id 58760, offset 0, flags [DF], proto TCP (6), length 52) 192.168.178.39.59789 > 104.244.43.241.443: Flags [.], cksum 0xd0b1 (correct), ack 1, win 4117, options [nop,nop,TS val 459270943 ecr 2116109579], length 0
2016-09-20 01:36:16.743858 70:56:81:c0:89:31 > c0:25:06:0d:95:59, ethertype IPv4 (0x0800), length 294: (tos 0x0, ttl 64, id 59476, offset 0, flags [DF], proto TCP (6), length 280) 192.168.178.39.59789 > 104.244.43.241.443: Flags [P.], cksum 0x86e1 (correct), seq 1:229, ack 1, win 4117, options [nop,nop,TS val 459270943 ecr 2116109579], length 228
2016-09-20 01:36:16.776437 c0:25:06:0d:95:59 > 70:56:81:c0:89:31, ethertype IPv4 (0x0800), length 66: (tos 0x0, ttl 58, id 33951, offset 0, flags [DF], proto TCP (6), length 52) 104.244.43.241.443 > 192.168.178.39.59789: Flags [.], cksum 0xdf9f (correct), ack 229, win 59, options [nop,nop,TS val 2116109587 ecr 459270943], length 0
2016-09-20 01:36:16.779419 c0:25:06:0d:95:59 > 70:56:81:c0:89:31, ethertype IPv4 (0x0800), length 243: (tos 0x0, ttl 58, id 33952, offset 0, flags [DF], proto TCP (6), length 229) 104.244.43.241.443 > 192.168.178.39.59789: Flags [P.], cksum 0x13ca (correct), seq 1:178, ack 229, win 59, options [nop,nop,TS val 2116109587 ecr 459270943], length 177
2016-09-20 01:36:16.779464 70:56:81:c0:89:31 > c0:25:06:0d:95:59, ethertype IPv4 (0x0800), length 66: (tos 0x0, ttl 64, id 4502, offset 0, flags [DF], proto TCP (6), length 52) 192.168.178.39.59789 > 104.244.43.241.443: Flags [.], cksum 0xcef6 (correct), ack 178, win 4112, options [nop,nop,TS val 459270978 ecr 2116109587], length 0
2016-09-20 01:36:16.779925 70:56:81:c0:89:31 > c0:25:06:0d:95:59, ethertype IPv4 (0x0800), length 72: (tos 0x0, ttl 64, id 27371, offset 0, flags [DF], proto TCP (6), length 58) 192.168.178.39.59789 > 104.244.43.241.443: Flags [P.], cksum 0xb6e4 (correct), seq 229:235, ack 178, win 4112, options [nop,nop,TS val 459270978 ecr 2116109587], length 6